{
  "$ref": "#/definitions/tools",
  "definitions": {
    "tools": {
      "type": "object",
      "properties": {
        "slug": {
          "type": "string"
        },
        "title": {
          "type": "string"
        },
        "description": {
          "type": "string"
        },
        "image": {
          "anyOf": [
            {
              "anyOf": [
                {
                  "not": {}
                },
                {
                  "type": "string"
                }
              ]
            },
            {
              "type": "null"
            }
          ]
        },
        "category": {
          "type": "string",
          "enum": [
            "gratuit",
            "premium",
            "services"
          ]
        },
        "subcategory": {
          "type": "string"
        },
        "tags": {
          "type": "array",
          "items": {
            "type": "string"
          },
          "default": []
        },
        "premium": {
          "type": "boolean",
          "default": false
        },
        "priceFiat": {
          "anyOf": [
            {
              "anyOf": [
                {
                  "not": {}
                },
                {
                  "type": "number"
                }
              ]
            },
            {
              "type": "null"
            }
          ]
        },
        "priceCrypto": {
          "anyOf": [
            {
              "anyOf": [
                {
                  "not": {}
                },
                {
                  "type": "string"
                }
              ]
            },
            {
              "type": "null"
            }
          ]
        },
        "stripeProductId": {
          "anyOf": [
            {
              "anyOf": [
                {
                  "not": {}
                },
                {
                  "type": "string"
                }
              ]
            },
            {
              "type": "null"
            }
          ]
        },
        "downloadUrl": {
          "anyOf": [
            {
              "anyOf": [
                {
                  "not": {}
                },
                {
                  "type": "string"
                }
              ]
            },
            {
              "type": "null"
            }
          ]
        },
        "content": {},
        "$schema": {
          "type": "string"
        }
      },
      "required": [
        "slug",
        "title",
        "description",
        "category",
        "subcategory"
      ],
      "additionalProperties": false
    }
  },
  "$schema": "http://json-schema.org/draft-07/schema#"
}